{
  "schema_version": "1.0.0",
  "candidate_id": "CAND-SUPPORT-2026-07-31",
  "artifact_status": "final",
  "controls": [
    {"control_id": "CTRL-TENANT", "description": "Enforce caller and tenant authorization before retrieval and before returning protected content.", "risk_ids": ["RISK-DISCLOSURE"], "owner_actor_id": "ACT-CONTROL", "status": "Verified", "implementation_refs": ["code://retrieval/authorization-filter@3a4e0e6"], "verification_evidence_ids": ["EVID-SECURITY"], "verified_at": "2026-07-30T10:00:00Z", "verification_valid_until": "2026-10-28T10:00:00Z", "acceptance_criteria": "No unauthorized item reaches model context or output across every declared tenant and role boundary."},
    {"control_id": "CTRL-INJECTION", "description": "Disable external tools and automatic remote fetches, isolate retrieved text, and safely render generated links.", "risk_ids": ["RISK-INJECTION"], "owner_actor_id": "ACT-CONTROL", "status": "Verified", "implementation_refs": ["code://runtime/tool-policy@3a4e0e6", "code://renderer/url-policy@3a4e0e6"], "verification_evidence_ids": ["EVID-REDTEAM"], "verified_at": "2026-07-30T11:00:00Z", "verification_valid_until": "2026-10-28T11:00:00Z", "acceptance_criteria": "Declared direct and indirect attacks cannot cause unauthorized disclosure, egress, or side effects."},
    {"control_id": "CTRL-QUALITY", "description": "Require source citations, evaluate supported claims and abstention, and route unresolved questions to support specialists.", "risk_ids": ["RISK-UNSUPPORTED"], "owner_actor_id": "ACT-CONTROL", "status": "Verified", "implementation_refs": ["code://answering/evidence-policy@3a4e0e6"], "verification_evidence_ids": ["EVID-EVALUATION", "EVID-GRADER"], "verified_at": "2026-07-30T12:00:00Z", "verification_valid_until": "2026-09-13T12:00:00Z", "acceptance_criteria": "Every blocking unsupported-answer and must-abstain case passes its predeclared rule."},
    {"control_id": "CTRL-PRIVACY", "description": "Minimize model context and event records, restrict access, and apply documented retention and deletion.", "risk_ids": ["RISK-PRIVACY"], "owner_actor_id": "ACT-CONTROL", "status": "Verified", "implementation_refs": ["config://logging/minimized-v1", "procedure://data/deletion-v1"], "verification_evidence_ids": ["EVID-PRIVACY"], "verified_at": "2026-07-30T13:00:00Z", "verification_valid_until": "2027-01-26T13:00:00Z", "acceptance_criteria": "Only authorized, necessary data enters model context, evidence, analytics, and retained event records."},
    {"control_id": "CTRL-RESOURCE", "description": "Apply authenticated quotas and limits for input, output, concurrency, time, retries, and cost.", "risk_ids": ["RISK-AVAILABILITY"], "owner_actor_id": "ACT-CONTROL", "status": "Verified", "implementation_refs": ["config://runtime/limits-v1"], "verification_evidence_ids": ["EVID-SECURITY", "EVID-MONITORING"], "verified_at": "2026-07-30T14:00:00Z", "verification_valid_until": "2026-10-28T10:00:00Z", "acceptance_criteria": "Boundary and load cases remain within approved resource and graceful-failure limits."}
  ]
}
